[
  {
    "id": "chem_dilution_reference_assumption_001",
    "paper_id": "chem_dilution_reference",
    "source_span": {
      "source_file": "source/source.pdf",
      "start": { "page": 1, "offset": 0 },
      "end": { "page": 1, "offset": 80 }
    },
    "text": "The solution is well mixed so that solute amount in a state is modeled as concentration times volume (rational idealization).",
    "kind": "physical_regime",
    "explicit_or_implicit": "explicit",
    "normalization_status": "normalized"
  },
  {
    "id": "chem_dilution_reference_assumption_002",
    "paper_id": "chem_dilution_reference",
    "source_span": {
      "source_file": "source/source.pdf",
      "start": { "page": 1, "offset": 81 },
      "end": { "page": 1, "offset": 119 }
    },
    "text": "Concentrations, volumes, and scale factors are rational numbers; any division is only by nonzero denominators.",
    "kind": "domain_restriction",
    "explicit_or_implicit": "explicit",
    "normalization_status": "normalized"
  }
]
